{
  "schema_version": "1.0",
  "checklist_id": "PLACEHOLDER_UUID_FOR_REAL_CHECKLIST",
  "target_network": "testnet",
  "target_commit": "PLACEHOLDER_COMMIT_SHA",
  "checklist_date": "PLACEHOLDER_ISO_8601_TIMESTAMP",
  "maintainer": {
    "name": "PLACEHOLDER_MAINTAINER_NAME",
    "contact": "PLACEHOLDER_CONTACT_INFO"
  },
  "test_evidence": {
    "unit_tests": {
      "command": "cargo test --workspace --all-targets",
      "status": "passed",
      "evidence": "PLACEHOLDER_PATH_TO_TEST_OUTPUT",
      "notes": "All 70+ vault contract tests, 13 reward tests, and network-node tests passed"
    },
    "integration_tests": {
      "command": "cargo test --workspace --all-targets --test integration",
      "status": "passed",
      "evidence": "PLACEHOLDER_PATH_TO_INTEGRATION_TEST_OUTPUT",
      "notes": "All integration tests passed"
    },
    "smoke_tests": {
      "command": "./scripts/run-mocked-smoke-test.sh",
      "status": "passed",
      "evidence": "PLACEHOLDER_PATH_TO_SMOKE_TEST_OUTPUT",
      "notes": "Mocked smoke test flow completed successfully with lifecycle verification"
    }
  },
  "documentation_evidence": {
    "required_files": [
      {
        "path": "docs/maintainer-handoff-guide.md",
        "present": true,
        "reviewed": true
      },
      {
        "path": "docs/testnet-deployment-checklist.md",
        "present": true,
        "reviewed": true
      },
      {
        "path": "docs/deployment-failure-and-recovery-runbook.md",
        "present": true,
        "reviewed": true
      },
      {
        "path": "docs/testnet-configuration.md",
        "present": true,
        "reviewed": true
      },
      {
        "path": "docs/post-deployment-verification.md",
        "present": true,
        "reviewed": true
      },
      {
        "path": "docs/mock-post-deployment-smoke-test.md",
        "present": true,
        "reviewed": true
      },
      {
        "path": "docs/vault-security-review-template.md",
        "present": true,
        "reviewed": true
      },
      {
        "path": "docs/vault-security-review-example.md",
        "present": true,
        "reviewed": true
      }
    ],
    "accuracy_status": "accurate",
    "notes": "All required documentation present and reviewed for accuracy against current codebase"
  },
  "schema_evidence": {
    "schema_files": [
      {
        "path": "schemas/vault-interface.schema.json",
        "present": true,
        "validated": true
      },
      {
        "path": "schemas/vault-interface-v0.1.json",
        "present": true,
        "validated": true
      },
      {
        "path": "schemas/vault-event.schema.json",
        "present": true,
        "validated": true
      },
      {
        "path": "schemas/sdk-handoff.schema.json",
        "present": true,
        "validated": true
      },
      {
        "path": "schemas/contract-id-registry.schema.json",
        "present": true,
        "validated": true
      },
      {
        "path": "schemas/deployment-artifact.schema.json",
        "present": true,
        "validated": true
      },
      {
        "path": "schemas/mock-vault-deployment.schema.json",
        "present": true,
        "validated": true
      },
      {
        "path": "schemas/build-metadata.schema.json",
        "present": true,
        "validated": true
      }
    ],
    "validation_status": "valid",
    "version_consistency": "consistent",
    "notes": "All schemas validated successfully with consistent versioning"
  },
  "script_evidence": {
    "build_scripts": [
      {
        "path": "scripts/build-vault-wasm.sh",
        "functional": true,
        "notes": "Script executable and produces WASM binary with metadata"
      },
      {
        "path": "scripts/deploy-vault-template.sh",
        "functional": true,
        "notes": "Dry-run template functional for deployment validation"
      }
    ],
    "validation_scripts": [
      {
        "path": "scripts/validate-testnet-config.sh",
        "functional": true,
        "notes": "Validates testnet configuration examples"
      },
      {
        "path": "scripts/validate-sdk-handoff.py",
        "functional": true,
        "notes": "Validates SDK handoff schema compliance"
      },
      {
        "path": "scripts/validate-contract-id-registry.py",
        "functional": true,
        "notes": "Validates contract ID registry schema compliance"
      },
      {
        "path": "scripts/validate-mock-vault-deployment.py",
        "functional": true,
        "notes": "Validates mock vault deployment examples"
      },
      {
        "path": "scripts/validate-vault-initialization-input.py",
        "functional": true,
        "notes": "Validates vault initialization input examples"
      },
      {
        "path": "scripts/validate-deployment-artifact.py",
        "functional": true,
        "notes": "Validates deployment artifact schema compliance"
      },
      {
        "path": "scripts/validate-mvp-demo-scenario.py",
        "functional": true,
        "notes": "Validates MVP demo scenario fixtures"
      }
    ],
    "verification_scripts": [
      {
        "path": "scripts/verify-vault-deployment.sh",
        "functional": true,
        "notes": "Shell script for post-deployment verification"
      },
      {
        "path": "scripts/verify-vault-deployment.py",
        "functional": true,
        "notes": "Python script for post-deployment verification"
      }
    ],
    "release_packet_scripts": [
      {
        "path": "scripts/generate-release-packet.py",
        "functional": true,
        "notes": "Generates release packet with artifact collection"
      },
      {
        "path": "scripts/validate-release-packet.py",
        "functional": true,
        "notes": "Validates release packet manifest against schema"
      },
      {
        "path": "scripts/test-release-packet.py",
        "functional": true,
        "notes": "Tests release packet generator functionality"
      }
    ]
  },
  "example_evidence": {
    "example_files": [
      {
        "path": "examples/testnet-config.json",
        "present": true,
        "validated": true
      },
      {
        "path": "examples/build-metadata.json",
        "present": true,
        "validated": true
      },
      {
        "path": "examples/deployment-artifact.json",
        "present": true,
        "validated": true
      },
      {
        "path": "examples/sdk-handoff.json",
        "present": true,
        "validated": true
      },
      {
        "path": "examples/contract-id-registry.json",
        "present": true,
        "validated": true
      },
      {
        "path": "examples/vault-initialization-input.json",
        "present": true,
        "validated": true
      },
      {
        "path": "examples/mock-post-deployment-smoke-input.json",
        "present": true,
        "validated": true
      },
      {
        "path": "examples/mock-post-deployment-smoke-output.json",
        "present": true,
        "validated": true
      },
      {
        "path": "examples/post-deployment-verification.json",
        "present": true,
        "validated": true
      },
      {
        "path": "examples/mvp-demo-scenario/",
        "present": true,
        "validated": true
      },
      {
        "path": "examples/vault-events/",
        "present": true,
        "validated": true
      },
      {
        "path": "examples/vault-interface/",
        "present": true,
        "validated": true
      },
      {
        "path": "examples/deployment-failures/",
        "present": true,
        "validated": true
      },
      {
        "path": "examples/vault-deployment/",
        "present": true,
        "validated": true
      }
    ],
    "validation_status": "valid",
    "notes": "All example files validated successfully against their respective schemas"
  },
  "security_review_evidence": {
    "security_review_status": "reviewed",
    "known_issues": [
      {
        "description": "Current vault records accounting values without transferring tokens",
        "impact": "medium",
        "mitigation_status": "accepted_risk",
        "notes": "Testnet-only deployment; not production-ready. Token transfer logic will be added in future version."
      },
      {
        "description": "set_claimable_reward and set_reward_balance methods do not require authorization",
        "impact": "high",
        "mitigation_status": "accepted_risk",
        "notes": "Testnet-only deployment; authorization requirements will be added before mainnet deployment."
      },
      {
        "description": "No formal security audit completed",
        "impact": "high",
        "mitigation_status": "accepted_risk",
        "notes": "This is testnet-only deployment for development and testing purposes. Formal audit required before mainnet deployment."
      }
    ],
    "secret_exclusion_verified": true,
    "notes": "Security review completed using vault-security-review-template.md. No secrets or private keys found in repository."
  },
  "release_packet_evidence": {
    "generation_status": {
      "status": "generated",
      "packet_path": "PLACEHOLDER_PATH_TO_RELEASE_PACKET",
      "notes": "Release packet generated with 16 documentation files, 14 schemas, 15 examples, and 28 scripts"
    },
    "validation_status": {
      "status": "valid",
      "notes": "All validations passed: schema compliance, required fields, security boundary, checksums, and secret detection"
    },
    "review_status": {
      "documentation_review": true,
      "schema_review": true,
      "example_review": true,
      "script_review": true,
      "notes": "All artifacts in release packet reviewed and verified"
    }
  },
  "known_limitations": {
    "codebase_limitations": [
      {
        "description": "Current vault records accounting values without transferring tokens",
        "impact": "medium",
        "mitigation": "Testnet-only deployment; token transfer logic will be added in future version"
      },